title,source,link,target_user,pain_point,automation_idea,monetization,repeat_score,willingness_score,difficulty_score,competition_score,automation_fit_score,final_score,reason
"Monday.com keeps crashing like my CRM. I need other options, help!",reddit/r/productivity,https://www.reddit.com/r/productivity/comments/1jm3a1l/mondaycom_keeps_crashing_like_my_crm_i_need_other/,Creative agencies needing a CRM solution,Inability to manage large databases and send bulk emails efficiently,"A CRM tool that allows bulk contact management, email tracking, and automated follow-ups with customizable features",Subscription model for access to advanced CRM features and integrations,8,9,5,6,9,7.7,"많은 크리에이티브 에이전시들이 CRM 솔루션을 필요로 하며, 자동화된 기능이 큰 도움이 될 것입니다."
Engineer w/ ADHD - Need a daily dashboard app,reddit/r/productivity,https://www.reddit.com/r/productivity/comments/1gqdd3b/engineer_w_adhd_need_a_daily_dashboard_app/,engineers with ADHD needing productivity tools,"difficulty in tracking multiple tasks, appointments, and communications across various platforms","a customizable dashboard app that integrates with Outlook, Teams, Slack, Jira, and other tools to consolidate tasks and appointments in one view",subscription model for premium features and integrations,9,8,6,5,9,7.65,이 사용자는 여러 플랫폼에서 작업과 약속을 추적하는 데 어려움을 겪고 있습니다.
"Integrated personalized consolidated content ""news feed"" for automatically tracking/monitoring content from favorite external sources for research, idea generation, social monitoring or just generally keeping up to date with your industry or market etc...",reddit/r/productivity,https://www.reddit.com/r/productivity/comments/qsxok7/integrated_personalized_consolidated_content_news/,Individuals looking to consolidate and automate content tracking from various external sources for research and productivity.,"The need to manually visit multiple sources daily to track and monitor content, which is time-consuming and inefficient.","A tool or integration that automatically aggregates content from various external sources into a single dashboard, with the ability to sync with productivity tools like Notion.","Subscription model for premium features, such as advanced integrations, additional sources, or enhanced analytics.",9,8,5,6,9,7.65,사용자가 여러 소스를 수동으로 방문하는 데 시간을 낭비하고 있어 자동화된 솔루션에 대한 수요가 높습니다.
Is there an Anki-like app for scheduling procedural knowledge/problem-solving tasks rather than just declarative memorization?,reddit/r/productivity,https://www.reddit.com/r/productivity/comments/1sg2fcx/is_there_an_ankilike_app_for_scheduling/,students and professionals seeking to improve procedural knowledge and problem-solving skills,lack of tools for scheduling and practicing procedural knowledge tasks effectively,an app that uses spaced repetition to generate and schedule procedural problem-solving tasks based on user skill level,subscription model for access to advanced features and personalized task generation,7,8,6,7,9,7.45,이 앱은 절차적 지식 연습을 위한 자동화된 솔루션을 제공하여 사용자의 학습 효율성을 높일 수 있습니다.
I stopped trying to come up with the perfect productivity system and started to detect micro friction instead.,reddit/r/productivity,https://www.reddit.com/r/productivity/comments/1u0kcqr/i_stopped_trying_to_come_up_with_the_perfect/,professionals and students who frequently create presentations or briefs,"time-consuming and frustrating process of copying and pasting content from messy PDFs or web pages, leading to broken formatting","a tool that automatically extracts and formats text and images from PDFs and web pages into a clean, ready-to-use format for presentations or documents","subscription model for individuals and teams, or a one-time purchase for the software",8,7,6,5,9,7.1,작업의 반복성과 자동화 가능성이 높아 수익화 가능성이 있음
Superhuman alternative? What are you using for email management?,reddit/r/productivity,https://www.reddit.com/r/productivity/comments/1tux8za/superhuman_alternative_what_are_you_using_for/,individuals seeking efficient email management solutions,frustration with sorting emails and finding a suitable email client that meets specific needs,"an AI-driven email management tool that automatically sorts, summarizes, and prioritizes emails based on user-defined criteria",subscription model for premium features or a one-time purchase for basic functionality,8,7,5,6,9,7.1,이메일 관리의 효율성을 높일 수 있는 자동화 도구에 대한 수요가 있다.
Repetitive tasks hurt my brain.,reddit/r/productivity,https://www.reddit.com/r/productivity/comments/1trmnub/repetitive_tasks_hurt_my_brain/,employees in companies with inadequate training,repetitive correction of mistakes due to lack of training,an automated training and feedback system that identifies common errors and provides tailored training modules,subscription model for companies to access the training platform,8,7,6,5,9,7.1,직원 교육 부족으로 인한 반복적인 문제 해결을 자동화할 수 있는 기회가 있다.
half of my day in firefight-mode,reddit/r/productivity,https://www.reddit.com/r/productivity/comments/1tq4v90/half_of_my_day_in_firefightmode/,business owners with multiple employees,"spending excessive time on unplanned, ad-hoc tasks","a task management tool that categorizes and prioritizes tasks, automating delegation and reminders for urgent issues",subscription model for the task management tool,8,7,5,6,9,7.1,업무 자동화로 시간을 절약할 수 있습니다.
Need some help cutting down on screen time.,reddit/r/productivity,https://www.reddit.com/r/productivity/comments/1tcf4w9/need_some_help_cutting_down_on_screen_time/,individuals trying to reduce screen time while staying connected,missing important notifications while apps are blocked to limit screen time,an app that allows users to set screen time limits while selectively allowing notifications from specific contacts or apps,subscription model for premium features like advanced notification settings and analytics on screen time usage,8,7,6,5,9,7.1,사용자가 스크린 타임을 줄이면서 중요한 알림을 놓치지 않도록 도와주는 자동화 솔루션이 필요합니다.
Keeping track of tasks and staying productive with terrible goldfish memory,reddit/r/productivity,https://www.reddit.com/r/productivity/comments/1sxohex/keeping_track_of_tasks_and_staying_productive/,Individuals with memory issues or cognitive impairments seeking productivity solutions,Difficulty in remembering tasks and staying organized due to poor memory,"A simple task management app that uses reminders and visual cues, allowing users to categorize tasks with minimal input and using intuitive language",Subscription model for premium features or a one-time purchase for the app,8,7,6,5,9,7.1,기억력이 떨어지는 사람들을 위한 간단한 작업 관리 앱이 필요하다.
AI has been surprisingly useful for one very annoying office task,reddit/r/productivity,https://www.reddit.com/r/productivity/comments/1sqj1nh/ai_has_been_surprisingly_useful_for_one_very/,office workers handling financial reports,time-consuming cleanup after copy-pasting tables from PDFs,an AI tool that extracts tables from PDFs and formats them for spreadsheets,subscription model for businesses that regularly process financial reports,8,7,6,5,9,7.1,이 작업은 반복적이며 자동화에 적합합니다.
Suggestions to Automating Customer Letters,reddit/r/productivity,https://www.reddit.com/r/productivity/comments/1spgcbz/suggestions_to_automating_customer_letters/,employees who generate customer letters,time-consuming process of creating and sending customer letters,"develop a template-based letter generation tool that auto-fills customer details, reviews, converts to PDF, and sends via email",subscription model for businesses needing automated letter generation,8,7,6,5,9,7.1,자동화 가능성이 높고 반복적인 작업이므로 효율성을 크게 향상시킬 수 있습니다.
What kinds of repetitive tasks have y'all tried and failed to automate?,reddit/r/productivity,https://www.reddit.com/r/productivity/comments/1skwb77/what_kinds_of_repetitive_tasks_have_yall_tried/,professionals needing to generate weekly reports and status updates,inefficient AI tools that require excessive editing and lack data integration,a customizable AI report generator that seamlessly integrates with various data sources and minimizes manual editing,subscription model for businesses to access the tool with tiered pricing based on usage,8,7,5,6,9,7.1,"주간 보고서 자동화에 대한 수요가 높지만, 현재 도구들이 부족함."
24M – I feel like my brain changed completely after 19… should I see a psychiatrist?,reddit/r/productivity,https://www.reddit.com/r/productivity/comments/1s7mg7m/24m_i_feel_like_my_brain_changed_completely_after/,young adults experiencing social anxiety and cognitive difficulties,struggling with social interactions and maintaining friendships,an AI-driven social interaction coach that provides real-time feedback and conversation prompts during social situations,subscription model for access to personalized coaching and resources,8,7,6,5,9,7.1,사회적 상호작용에 어려움을 겪는 사람들을 위한 자동화된 코칭 솔루션이 필요하다.
"Any computer programs that can track my specific activity (clicks, typing, and the like) in Unity (game development program)?",reddit/r/productivity,https://www.reddit.com/r/productivity/comments/1nmur3e/any_computer_programs_that_can_track_my_specific/,freelance game developers and asset creators,forgetting to track work hours accurately,"a program that logs user activity (clicks, typing) in specific applications like Unity",subscription model for the tracking software or one-time purchase,8,7,6,5,9,7.1,이 문제는 반복적이며 자동화로 해결할 수 있습니다.
Calendar -> Focus Mode To Do automation,reddit/r/productivity,https://www.reddit.com/r/productivity/comments/1hqqeyq/calendar_focus_mode_to_do_automation/,Individuals with ADHD or neurodivergent traits seeking productivity,Difficulty in managing focus and timeboxing due to distractions,An integrated app that connects calendar events with focus apps to automatically trigger focus modes and manage time blocks,Subscription model for premium features like advanced analytics and integrations with multiple focus apps,8,7,6,5,9,7.1,이 자동화는 집중력 향상과 시간 관리에 도움을 줄 수 있습니다.
"(Motion)Looking to replace my producivity/project management app, any tips?",reddit/r/productivity,https://www.reddit.com/r/productivity/comments/1f9x8lp/motionlooking_to_replace_my_producivityproject/,project leads in railroad construction,time-consuming manual setup of project deadlines and milestones based on no traffic periods,"an app that automatically calculates deadlines for tasks based on a specified date, integrates with calendar systems, and automates reminders and progress updates",subscription model for individual users or licensing for companies in the construction industry,8,7,6,5,9,7.1,자동으로 마감일을 계산하고 알림을 보내는 앱은 반복적인 작업을 줄여줄 수 있습니다.
Help! Are there habit trackers for app usage?,reddit/r/productivity,https://www.reddit.com/r/productivity/comments/1b46rof/help_are_there_habit_trackers_for_app_usage/,Individuals with ADHD seeking to improve habit tracking for app usage,"Difficulty in consistently tracking habits and tasks, especially digital ones, due to forgetfulness or lack of motivation","An app that monitors app usage in the background and prompts users to log their activity, similar to fitness trackers",Subscription model or one-time purchase for the app,8,7,5,6,9,7.1,ADHD를 가진 사람들이 디지털 습관을 추적하는 데 어려움을 겪고 있어 자동화된 솔루션이 필요하다.
Simple GTD system in Apple ecosystem,reddit/r/productivity,https://www.reddit.com/r/productivity/comments/1ahygep/simple_gtd_system_in_apple_ecosystem/,individuals seeking a simple productivity system,overwhelmed by complex productivity tools and systems,a streamlined app that integrates Apple Notes and Reminders with enhanced tagging and smart folder capabilities,subscription model for premium features like advanced tagging and analytics,8,7,6,5,9,7.1,사용자가 복잡한 도구에 압도당하지 않도록 돕는 간단한 솔루션이 필요합니다.
"I spent 15 hours watching/reading about apps that provide Project Management + Note Taking, thought i'd share my findings",reddit/r/productivity,https://www.reddit.com/r/productivity/comments/126pb08/i_spent_15_hours_watchingreading_about_apps_that/,freelancers and individuals with ADHD seeking productivity tools,difficulty in finding a suitable project management and note-taking app that minimizes resistance and is easy to use,"a personalized app recommendation engine that curates and suggests productivity tools based on user preferences and needs, with a focus on ease of use and integration","subscription model for premium features, such as personalized consultations or advanced filtering options",8,7,5,6,9,7.1,사용자가 필요로 하는 앱을 쉽게 찾을 수 있도록 도와주는 자동화된 추천 시스템이 필요하다.
I want to maximise my productivity in a data driven manner..,reddit/r/productivity,https://www.reddit.com/r/productivity/comments/r1a5vp/i_want_to_maximise_my_productivity_in_a_data/,tech professionals seeking to improve productivity,inefficient tracking of time spent on various websites leading to decreased productivity,"A Chrome extension that automatically tracks time spent on active windows across multiple monitors, ignoring inactive windows and periods of inactivity.",Subscription model for premium features such as detailed analytics and productivity reports.,8,7,6,5,9,7.1,이 사용자는 생산성을 높이기 위해 자동화된 시간 추적 도구를 필요로 합니다.
Best software for Folder & File management (ideally free),reddit/r/productivity,https://www.reddit.com/r/productivity/comments/lx41mo/best_software_for_folder_file_management_ideally/,users needing automated file management solutions,inability to perform multiple automated actions on files in a folder,"develop a software that allows users to set multiple automated actions (like rename, print, and move) for files added to a monitored folder",subscription model or one-time purchase for the software,8,7,5,6,9,7.1,"파일 관리 자동화에 대한 수요가 높고, 현재 솔루션이 부족하다."
Personal task manager app - From visual strategic conception to optimized execution,reddit/r/productivity,https://www.reddit.com/r/productivity/comments/luqtz1/personal_task_manager_app_from_visual_strategic/,individuals seeking an integrated personal task management solution,the lack of a comprehensive task management tool that combines visual flowcharting with time-blocking and calendar features,"develop a personal task manager app that integrates flowchart design, hierarchical to-do lists, kanban boards, and calendar functionalities with automated time-blocking and delay accommodations",subscription model for premium features or one-time purchase for app access,8,7,6,5,9,7.1,"이 문제는 많은 사람들이 겪고 있으며, 통합된 솔루션에 대한 수요가 높습니다."
Small business owners – what tech task took you the longest to figure out when you started?,reddit/r/smallbusiness,https://www.reddit.com/r/smallbusiness/comments/1r4iuz3/small_business_owners_what_tech_task_took_you_the/,small business owners,confusion and time consumption in setting up tech systems,"a guided setup tool for small business tech tasks (website, payment systems, CRM, etc.)",subscription model for ongoing support and updates,8,7,6,5,9,7.1,소규모 비즈니스 소유자들이 기술 시스템 설정에 어려움을 겪고 있어 자동화 도구가 필요하다.
Opening first Auto Repair Shop this year!,reddit/r/smallbusiness,https://www.reddit.com/r/smallbusiness/comments/1qb1b4q/opening_first_auto_repair_shop_this_year/,new auto repair shop owners,finding reliable software and resources for shop management and finances,"a centralized platform that integrates scheduling, financial tracking, and resource recommendations for auto repair shops",subscription model for access to the platform with additional fees for premium features like personalized consulting,8,7,5,6,9,7.1,자동차 수리점 소유자들이 소프트웨어와 자원을 찾는 데 어려움을 겪고 있어 자동화 플랫폼이 유용할 것입니다.
Please don’t use this platform. Seriously.,reddit/r/smallbusiness,https://www.reddit.com/r/smallbusiness/comments/1q6ubha/please_dont_use_this_platform_seriously/,small business owners using Microsoft 365,time spent troubleshooting and managing sync issues with Microsoft 365,a tool that automates troubleshooting and sync management for Microsoft 365 users,subscription model for ongoing support and updates,8,7,6,5,9,7.1,중소기업 소유자가 Microsoft 365의 문제를 해결하는 데 많은 시간을 낭비하고 있습니다.
Outgrowing our credit union. What banking setup are other small businesses using?,reddit/r/smallbusiness,https://www.reddit.com/r/smallbusiness/comments/1pxvi2p/outgrowing_our_credit_union_what_banking_setup/,small business owners using Shopify,unreliable integrations with online banking tools and lack of financing options,"a platform that integrates Shopify sales data with multiple banking options, automating financial management and providing tailored financing solutions",subscription model for businesses to access premium features and integrations,8,7,5,6,9,7.1,소규모 비즈니스가 금융 관리와 자금 조달을 자동화할 수 있는 솔루션이 필요하다.
I thought customers would be the bottleneck... (I was wrong),reddit/r/smallbusiness,https://www.reddit.com/r/smallbusiness/comments/1o6p3fd/i_thought_customers_would_be_the_bottleneck_i_was/,small business owners in the tutoring industry,inefficient training processes for employees,"an automated training platform that integrates video hosting, quizzes, and progress tracking",subscription model for access to the training platform and resources,8,7,5,6,9,7.1,소규모 튜터링 비즈니스에서 직원 교육의 비효율성을 해결할 수 있는 자동화 기회입니다.
Quick Interview Request for Class Project – Your Experience with Small Business Grants,reddit/r/smallbusiness,https://www.reddit.com/r/smallbusiness/comments/1ma8ytj/quick_interview_request_for_class_project_your/,small business owners seeking grants,difficulty in finding and applying for grants,a platform that aggregates grant opportunities and provides a streamlined application process,subscription model for premium features or a commission on successful grant applications,8,7,5,6,9,7.1,소규모 사업자들이 보조금 찾기와 신청 과정에서 어려움을 겪고 있어 이를 해결할 수 있는 자동화 플랫폼이 필요하다.
My first 6 Months as an Entrepreneur: My journey & seeking mentorship and collaboration with fellow entrepreneurs!,reddit/r/smallbusiness,https://www.reddit.com/r/smallbusiness/comments/1eknoc7/my_first_6_months_as_an_entrepreneur_my_journey/,first-time entrepreneurs with ADHD,difficulty managing tasks and staying organized due to executive dysfunction,"a task management tool that integrates with existing platforms (like Google Calendar, Trello) and uses reminders and gamification to help users stay on track",subscription model for premium features or one-time purchase for the app,8,7,6,5,9,7.1,ADHD를 가진 첫 번째 기업가들이 작업 관리와 조직 유지에 어려움을 겪고 있습니다.
When is the right time to invest in technology for your business?,reddit/r/smallbusiness,https://www.reddit.com/r/smallbusiness/comments/1hin14t/when_is_the_right_time_to_invest_in_technology/,small business owners considering technology investment,hesitation in deciding when to invest in technology due to costs and adjustment challenges,a decision-making tool that analyzes business processes and suggests optimal times to invest in technology based on specific metrics,subscription model for ongoing access to the tool and personalized consulting services,7,8,6,5,8,7.0,소규모 비즈니스가 기술 투자 시기를 결정하는 데 어려움을 겪고 있어 자동화 도구가 필요하다.
How to study as someone who has ADHD? and feel tired all the time,reddit/r/productivity,https://www.reddit.com/r/productivity/comments/1tiopqf/how_to_study_as_someone_who_has_adhd_and_feel/,students with ADHD or focus issues,inability to focus for extended periods and fatigue despite adequate sleep,"a personalized study planner app that incorporates short focus sessions with breaks, reminders, and gamification to enhance motivation and retention",subscription model for premium features like personalized study plans and progress tracking,8,7,5,6,8,6.95,ADHD 학생들이 집중하기 어려운 문제를 해결할 수 있는 앱입니다.
What's the most painful repetitive browser task you do weekly?,reddit/r/productivity,https://www.reddit.com/r/productivity/comments/1t55tcu/whats_the_most_painful_repetitive_browser_task/,individuals who perform repetitive browser tasks weekly,frustration from repetitive browser tasks,"a browser extension that automates common repetitive tasks like form filling, data scraping, or tab management",subscription model for premium features or one-time purchase for the extension,8,7,4,6,9,6.95,반복적인 브라우저 작업을 자동화하는 것은 많은 사람들에게 유용할 수 있습니다.
How to stop Circling Productivity?,reddit/r/productivity,https://www.reddit.com/r/productivity/comments/1sihg8y/how_to_stop_circling_productivity/,students or professionals struggling with productivity and focus,inability to focus on important tasks despite engaging in productive habits,"a productivity app that uses gamification to encourage users to complete deep work tasks, integrating timers, rewards, and accountability features",subscription model for premium features or in-app purchases for additional gamification elements,8,7,6,5,8,6.95,"이 문제는 많은 사람들이 경험하며, 자동화된 솔루션이 효과적일 수 있습니다."
Using two computers simultaneously? Is it a productivity neg?,reddit/r/productivity,https://www.reddit.com/r/productivity/comments/14gk0jh/using_two_computers_simultaneously_is_it_a/,users with dual computer setups seeking seamless interaction,frustration with switching between computers and lag in file transfer,a smart mouse that can toggle between computers with a temporary 'flow mode' for seamless file dragging,selling the smart mouse or a subscription service for software that enhances its functionality,8,7,5,6,8,6.95,이중 컴퓨터 사용자의 불편함을 해결할 수 있는 자동화 기회입니다.
[Advice] The elephant in the productivity room,reddit/r/productivity,https://www.reddit.com/r/productivity/comments/n9sls7/advice_the_elephant_in_the_productivity_room/,individuals seeking to improve productivity and goal tracking,overwhelmed by the abundance of productivity apps and difficulty in selecting the right one,a personalized app recommendation tool that analyzes user preferences and goals to suggest the best productivity apps,"subscription model for premium features, such as personalized coaching or advanced analytics",8,7,6,4,9,6.95,사용자가 원하는 앱을 찾는 데 어려움을 겪고 있어 자동화된 추천 시스템이 유용할 것입니다.
VAT Calculator | UK,reddit/r/smallbusiness,https://www.reddit.com/r/smallbusiness/comments/1dq8lrm/vat_calculator_uk/,small business owners in the UK,managing and calculating VAT accurately,an automated VAT calculator tool that integrates with accounting software,subscription model for businesses to access advanced features and updates,8,7,4,6,9,6.95,소규모 비즈니스 소유자들은 VAT 계산을 자주 해야 하므로 자동화 도구에 대한 수요가 높습니다.
Being Threatened. What should I do?,reddit/r/smallbusiness,https://www.reddit.com/r/smallbusiness/comments/1ngk9g6/being_threatened_what_should_i_do/,small business owners facing threats or intimidation from former employers or competitors,fear of intimidation and threats affecting business operations,a legal advice chatbot that provides guidance on handling threats and intimidation in business contexts,"subscription model for ongoing legal advice and resources, or a one-time fee for personalized consultations",7,8,5,6,7,6.85,"이런 문제는 자주 발생하며, 법률 상담에 대한 수요가 높기 때문에 유용한 자동화 기회입니다."
Reality-HIT,reddit/r/smallbusiness,https://www.reddit.com/r/smallbusiness/comments/1rc2fw1/realityhit/,individuals seeking remote work opportunities in tech fields,difficulty finding job openings and networking opportunities,"a platform that automates job matching based on skills and location, connecting users with potential employers and networking opportunities","subscription model for job seekers and employers, or charging for premium features like resume reviews and portfolio showcases",8,7,5,4,9,6.8,구직자와 고용주를 자동으로 연결하는 플랫폼은 반복적인 문제를 해결할 수 있습니다.
